keyword,category
best neighborhoods to stay in Seoul for first timers,travel
Korean spa and jjimjilbang guide for foreigners,living
how to buy K-pop merchandise in Korea,k-culture
must try Korean breakfast foods,k-food
Busan one day itinerary for tourists,travel
Korean age system explained for foreigners,living
best K-drama filming locations to visit in Seoul,k-culture
top Korean fried chicken restaurants in Seoul,k-food
Jeju Island travel guide for first timers,travel
how to open a bank account in Korea as a foreigner,living
best K-pop idol cafes in Seoul,k-culture
Korean street food you must try in Busan,k-food
DMZ tour from Seoul complete guide,travel
Korean mobile payment apps guide for tourists,living
best places to watch K-pop performances in Seoul,k-culture
traditional Korean desserts you need to try,k-food
Gyeongbokgung Palace complete visitor guide,travel
how to get a SIM card in Korea as a foreigner,living
Korean beauty skincare routine for beginners,k-culture
best Korean ramen spots in Seoul,k-food
Incheon Airport transit guide layover tips,travel
Korean etiquette rules tourists should know,living
BTS and Bangtan spots to visit in Seoul,k-culture
best Korean bbq restaurants in Hongdae,k-food
Nami Island day trip guide from Seoul,travel
how to use Korean public bathrooms,living
best K-drama actors currently popular in Korea,k-culture
hidden gem restaurants locals eat at in Seoul,k-food
